{
  "schemaVersion": 1,
  "territories": [
    { "id": "t1", "neighbors": ["t2", "t4"], "x": 100, "y": 50 },
    { "id": "t2", "neighbors": ["t1", "t3", "t5"], "x": 300, "y": 50 },
    { "id": "t3", "neighbors": ["t2", "t6"], "x": 500, "y": 50 },
    { "id": "t4", "neighbors": ["t1", "t5", "t7"], "x": 100, "y": 150 },
    { "id": "t5", "neighbors": ["t2", "t4", "t6", "t8"], "x": 300, "y": 150 },
    { "id": "t6", "neighbors": ["t3", "t5", "t9"], "x": 500, "y": 150 },
    { "id": "t7", "neighbors": ["t4", "t8", "t10"], "x": 100, "y": 250 },
    { "id": "t8", "neighbors": ["t5", "t7", "t9", "t11"], "x": 300, "y": 250 },
    { "id": "t9", "neighbors": ["t6", "t8", "t12"], "x": 500, "y": 250 },
    { "id": "t10", "neighbors": ["t7", "t11"], "x": 100, "y": 350 },
    { "id": "t11", "neighbors": ["t8", "t10", "t12"], "x": 300, "y": 350 },
    { "id": "t12", "neighbors": ["t9", "t11"], "x": 500, "y": 350 }
  ],
  "continents": [
    { "name": "north", "territories": ["t1", "t2", "t3"], "bonus": 2 },
    { "name": "center", "territories": ["t4", "t5", "t6"], "bonus": 2 },
    { "name": "south", "territories": ["t7", "t8", "t9"], "bonus": 2 },
    { "name": "island", "territories": ["t10", "t11", "t12"], "bonus": 2 }
  ],
  "deck": [
    { "territory": "t1", "type": "infantry" },
    { "territory": "t1", "type": "cavalry" },
    { "territory": "t1", "type": "artillery" },
    { "territory": "t2", "type": "infantry" },
    { "territory": "t2", "type": "cavalry" },
    { "territory": "t2", "type": "artillery" },
    { "territory": "t3", "type": "infantry" },
    { "territory": "t3", "type": "cavalry" },
    { "territory": "t3", "type": "artillery" },
    { "territory": "t4", "type": "infantry" },
    { "territory": "t4", "type": "cavalry" },
    { "territory": "t4", "type": "artillery" },
    { "territory": "t5", "type": "infantry" },
    { "territory": "t5", "type": "cavalry" },
    { "territory": "t5", "type": "artillery" },
    { "territory": "t6", "type": "infantry" },
    { "territory": "t6", "type": "cavalry" },
    { "territory": "t6", "type": "artillery" },
    { "territory": "t7", "type": "infantry" },
    { "territory": "t7", "type": "cavalry" },
    { "territory": "t7", "type": "artillery" },
    { "territory": "t8", "type": "infantry" },
    { "territory": "t8", "type": "cavalry" },
    { "territory": "t8", "type": "artillery" },
    { "territory": "t9", "type": "infantry" },
    { "territory": "t9", "type": "cavalry" },
    { "territory": "t9", "type": "artillery" },
    { "territory": "t10", "type": "infantry" },
    { "territory": "t10", "type": "cavalry" },
    { "territory": "t10", "type": "artillery" },
    { "territory": "t11", "type": "infantry" },
    { "territory": "t11", "type": "cavalry" },
    { "territory": "t11", "type": "artillery" },
    { "territory": "t12", "type": "infantry" },
    { "territory": "t12", "type": "cavalry" },
    { "territory": "t12", "type": "artillery" }
  ]
}
