{
  "schemaVersion": 1,
  "territories": [
    { "id": "t1", "neighbors": ["t2", "t4"], "x": 100, "y": 170 },
    { "id": "t2", "neighbors": ["t1", "t3", "t5"], "x": 170, "y": 140 },
    { "id": "t3", "neighbors": ["t2", "t6"], "x": 230, "y": 160 },
    { "id": "t4", "neighbors": ["t1", "t5"], "x": 270, "y": 195 },
    { "id": "t5", "neighbors": ["t2", "t4", "t6"], "x": 350, "y": 170 },
    { "id": "t6", "neighbors": ["t3", "t5"], "x": 330, "y": 250 }
  ],
  "continents": [
    { "name": "west", "territories": ["t1", "t2", "t3"], "bonus": 2 },
    { "name": "east", "territories": ["t4", "t5", "t6"], "bonus": 2 }
  ],
  "deck": [
    { "territory": "t1", "type": "infantry" },
    { "territory": "t2", "type": "cavalry" },
    { "territory": "t3", "type": "artillery" },
    { "territory": "t4", "type": "infantry" },
    { "territory": "t5", "type": "cavalry" },
    { "territory": "t6", "type": "artillery" },
    { "territory": "t1", "type": "infantry" },
    { "territory": "t2", "type": "cavalry" },
    { "territory": "t3", "type": "artillery" },
    { "territory": "t4", "type": "infantry" },
    { "territory": "t5", "type": "cavalry" },
    { "territory": "t6", "type": "artillery" },
    { "territory": "t1", "type": "infantry" },
    { "territory": "t2", "type": "cavalry" },
    { "territory": "t3", "type": "artillery" },
    { "territory": "t4", "type": "infantry" },
    { "territory": "t5", "type": "cavalry" },
    { "territory": "t6", "type": "artillery" },
    { "territory": "t1", "type": "infantry" },
    { "territory": "t2", "type": "cavalry" },
    { "territory": "t3", "type": "artillery" },
    { "territory": "t4", "type": "infantry" },
    { "territory": "t5", "type": "cavalry" },
    { "territory": "t6", "type": "artillery" },
    { "territory": "t1", "type": "infantry" },
    { "territory": "t2", "type": "cavalry" },
    { "territory": "t3", "type": "artillery" },
    { "territory": "t4", "type": "infantry" },
    { "territory": "t5", "type": "cavalry" },
    { "territory": "t6", "type": "artillery" },
    { "territory": "t1", "type": "infantry" },
    { "territory": "t2", "type": "cavalry" },
    { "territory": "t3", "type": "artillery" },
    { "territory": "t4", "type": "infantry" },
    { "territory": "t5", "type": "cavalry" },
    { "territory": "t6", "type": "artillery" },
    { "territory": "t1", "type": "infantry" },
    { "territory": "t2", "type": "cavalry" },
    { "territory": "t3", "type": "artillery" },
    { "territory": "t4", "type": "infantry" }
  ]
}
